{
  "blocking_dependencies": [
    "Atlas ingestion semantics",
    "App decision on whether Survey appears in this TestFlight build",
    "Final Canonical family/label policy"
  ],
  "created_at": "2026-05-21T22:37:28Z",
  "evidence_export_compatibility": {
    "apple_exports_as_exposure_prior": true,
    "apple_taste_truth_required_value": false,
    "construction_only_excluded_outside_atlas_ingestion": true,
    "one_atom_per_visible_response": true,
    "target_atlas_flow": [
      "Survey Evidence Export",
      "Signal",
      "AtlasNode",
      "provisional AtlasRoleAssignment",
      "PossibleAtlasUpdateCandidate",
      "AtlasDigestView"
    ],
    "target_schema_version": "waymark.survey_evidence_export.v0.1"
  },
  "packet_id": "alpha_survey_slate_packet:apple_biased:run_002_apple_biased:page_01",
  "page_count_recommendation": {
    "album_pages": 0,
    "alpha_status": "render_example_not_onboarding_recommendation",
    "artist_pages": 1,
    "config_id": "apple_biased_artist_page_001_render_example",
    "qualification": "single-page render fixture only; not an onboarding-length recommendation",
    "song_pages": 0,
    "tile_count": 12
  },
  "pages": [
    {
      "page_id": "page_01",
      "page_number": 1,
      "rendering": {
        "columns": "app_defined",
        "layout": "grid",
        "requires_ordered_tiles": true
      },
      "stage": "artist",
      "tile_count": 12,
      "tiles": [
        {
          "apple_exposure_prior": {
            "dimensions": {
              "album_completion_hint": 0.0,
              "artist_depth_hint": 0.959,
              "exact_signal_weight": 0.98,
              "exposure_score": 0.98,
              "favorite_or_rating_score": 0.0,
              "library_commitment_score": 0.896,
              "playlist_context_score": 0.18,
              "recency_score": 0.956,
              "repetition_score": 1.0
            },
            "interpretation": "exposure_prior",
            "is_present": true,
            "signal_ids": [
              "apple_01_01"
            ],
            "source": "apple_music",
            "taste_truth": false
          },
          "approved_graph_surface_ref": {
            "candidate_id": "survey-f3-artist-artist-fleetwood-mac-016",
            "review_status": "approved",
            "source": "canonical_graph_survey_surface_v0_2",
            "source_membership_id": "family-3-artist-016-artist-fleetwood-mac",
            "survey_intent": "song_first_memory",
            "survey_page_role": "page1_core"
          },
          "candidate_basis": [
            "active_survey_selection",
            "payload_signature_artist_bucket",
            "payload_overrepresentation",
            "apple_exact_match"
          ],
          "display": {
            "object_type": "artist",
            "primary_text": "Fleetwood Mac",
            "secondary_text": null
          },
          "display_order": 1,
          "evidence_export_linkage": {
            "evidence_atom_id": "survey_response:run_002_apple_biased:page_01:resp_01",
            "evidence_ref": "page_01:artist:01:fleetwood-mac:unanswered",
            "response_id": "run_002_apple_biased:page_01:resp_01",
            "supporting_visible_response_refs": []
          },
          "evidence_ref": "page_01:artist:01:fleetwood-mac:unanswered",
          "graph_refs": {
            "archetype_ids": [
              "016",
              "022"
            ],
            "best_recognition_tier": "mass",
            "best_survey_tier": "core",
            "family_numbers": [
              3
            ],
            "roles": [
              "album_anchor",
              "anchor",
              "bridge",
              "gateway",
              "song_first"
            ]
          },
          "music_object_ref": {
            "canonical_artist_id": "artist-fleetwood-mac",
            "display_name": "Fleetwood Mac",
            "object_type": "artist",
            "ref_source": "canonical_graph",
            "resolution_state": "resolved"
          },
          "page_intent": "payload_signature_artist",
          "render_tile_id": "page_01_tile_01",
          "response_capture": {
            "allowed_states": [
              "love",
              "like",
              "ok",
              "dont_like",
              "dont_know_enough"
            ],
            "captured_state": null,
            "normalized_operation": null,
            "note": null,
            "selected_tags": [],
            "selected_tags_semantics": "visible_signal_evidence",
            "shown_unselected_tags": [],
            "shown_unselected_tags_semantics": "weak_non_selected_context"
          },
          "response_id": "run_002_apple_biased:page_01:resp_01"
        },
        {
          "apple_exposure_prior": {
            "dimensions": {
              "album_completion_hint": 0.0,
              "artist_depth_hint": 0.925,
              "exact_signal_weight": 0.92,
              "exposure_score": 0.92,
              "favorite_or_rating_score": 0.0,
              "library_commitment_score": 0.886,
              "playlist_context_score": 0.18,
              "recency_score": 0.933,
              "repetition_score": 0.967
            },
            "interpretation": "exposure_prior",
            "is_present": true,
            "signal_ids": [
              "apple_01_02"
            ],
            "source": "apple_music",
            "taste_truth": false
          },
          "approved_graph_surface_ref": {
            "candidate_id": "survey-f3-artist-artist-tom-petty-and-the-heartbreakers-016",
            "review_status": "approved",
            "source": "canonical_graph_survey_surface_v0_2",
            "source_membership_id": "family-3-artist-016-artist-tom-petty-and-the-heartbreakers",
            "survey_intent": "song_first_memory",
            "survey_page_role": "page2_adaptive"
          },
          "candidate_basis": [
            "active_survey_selection",
            "payload_signature_artist_bucket",
            "payload_overrepresentation",
            "apple_exact_match"
          ],
          "display": {
            "object_type": "artist",
            "primary_text": "Tom Petty and the Heartbreakers",
            "secondary_text": null
          },
          "display_order": 2,
          "evidence_export_linkage": {
            "evidence_atom_id": "survey_response:run_002_apple_biased:page_01:resp_02",
            "evidence_ref": "page_01:artist:02:tom-petty-and-the-heartbreakers:unanswered",
            "response_id": "run_002_apple_biased:page_01:resp_02",
            "supporting_visible_response_refs": []
          },
          "evidence_ref": "page_01:artist:02:tom-petty-and-the-heartbreakers:unanswered",
          "graph_refs": {
            "archetype_ids": [
              "016"
            ],
            "best_recognition_tier": "mass",
            "best_survey_tier": "standard",
            "family_numbers": [
              3
            ],
            "roles": [
              "bridge",
              "gateway",
              "song_first"
            ]
          },
          "music_object_ref": {
            "canonical_artist_id": "artist-tom-petty-and-the-heartbreakers",
            "display_name": "Tom Petty and the Heartbreakers",
            "object_type": "artist",
            "ref_source": "canonical_graph",
            "resolution_state": "resolved"
          },
          "page_intent": "payload_signature_artist",
          "render_tile_id": "page_01_tile_02",
          "response_capture": {
            "allowed_states": [
              "love",
              "like",
              "ok",
              "dont_like",
              "dont_know_enough"
            ],
            "captured_state": null,
            "normalized_operation": null,
            "note": null,
            "selected_tags": [],
            "selected_tags_semantics": "visible_signal_evidence",
            "shown_unselected_tags": [],
            "shown_unselected_tags_semantics": "weak_non_selected_context"
          },
          "response_id": "run_002_apple_biased:page_01:resp_02"
        },
        {
          "apple_exposure_prior": {
            "dimensions": {
              "album_completion_hint": 0.0,
              "artist_depth_hint": 0.856,
              "exact_signal_weight": 0.86,
              "exposure_score": 0.86,
              "favorite_or_rating_score": 0.0,
              "library_commitment_score": 1.0,
              "playlist_context_score": 0.1,
              "recency_score": 0.8,
              "repetition_score": 0.717
            },
            "interpretation": "exposure_prior",
            "is_present": true,
            "signal_ids": [
              "apple_01_03"
            ],
            "source": "apple_music",
            "taste_truth": false
          },
          "approved_graph_surface_ref": {
            "candidate_id": "survey-f3-artist-artist-eagles-016",
            "review_status": "approved",
            "source": "canonical_graph_survey_surface_v0_2",
            "source_membership_id": "family-3-artist-016-artist-eagles",
            "survey_intent": "song_first_memory",
            "survey_page_role": "page1_core"
          },
          "candidate_basis": [
            "active_survey_selection",
            "payload_signature_artist_bucket",
            "payload_overrepresentation",
            "apple_exact_match"
          ],
          "display": {
            "object_type": "artist",
            "primary_text": "Eagles",
            "secondary_text": null
          },
          "display_order": 3,
          "evidence_export_linkage": {
            "evidence_atom_id": "survey_response:run_002_apple_biased:page_01:resp_03",
            "evidence_ref": "page_01:artist:03:eagles:unanswered",
            "response_id": "run_002_apple_biased:page_01:resp_03",
            "supporting_visible_response_refs": []
          },